 Team  ,Year,SimpleDescription,Description,Keywords,Chassis
Berkeley,2013,"By combining the biosynthesis of indigo and the use of the natural indigo precursor indican, we propose a more sustainable dyeing method as an alternative to chemically-reduced indigo in the large scale production of indigo textiles. We achieved in vivo indigo production in high titers, and efficient cleavage of indican using a non-native glucosidase.","The world consumes over 40 million kilograms of indigo annually, primarily for dyeing denim. Indigo is currently derived from petroleum using a high energy process, and commercial dyeing involves the use of reducing agents to solubilize the dye. The development of biosynthetic and bioprocessing methodologies for indigo dyeing could have environmental and economic advantages. By combining the biosynthesis of indigo and the use of the natural indigo precursor indican, we propose a more sustainable dyeing method as an alternative to chemically-reduced indigo in the large scale production of indigo textiles. We achieved in vivo indigo production in high titers, and efficient cleavage of indican using a non-native glucosidase. Inspired by natural systems, we isolated and characterized several plant and bacterial glucosyl transferases hypothesized to produce indican. Lastly, we compare the cost and environmental impact of our alternative with the present chemical process.",indigo   non-native glucosidase   blue denim   chemically-reduced   bacterial glucosyl,E.coli
Penn_State,2013,"Through synthetic biology, we are able to control the expression of genes that regulate the production of desired secondary metabolites. ","Plants as Plants: Natural Factories provides a green approach to the manufacturing of valuable chemicals and materials. Through synthetic biology, we are able to control the expression of genes that regulate the production of desired secondary metabolites. Via the manipulation of established metabolic pathways, we hope to produce vanillin and butanol. The prospect of being able to synthetically produce a biofuel provides vast possibilities for the scope of synthetic biology and green energy. Additionally through the manipulation of the cellulose synthase genes, we hope to increase the biomass of plants by a hybrid plant cell wall. As shown through these projects, the use of plants provides various green energy possibilities. However, due to the limited use of plants within synthetic biology there are various regulation issues. Thus we have additionally worked on characterizing a range of plant promoters as well as introducing the Cas9 crisper system into plants.", vanillin  Cas9 crisper system. butanol. the cellulose synthase genes. green energy,E. coli
Utah_State,2013,"Using Synthetic Biology as a platform, the production of AMPs in E.coli could potentially offer a cost-effective approach for large-scale peptide manufacture, as opposed to isolation from natural sources. ","Antimicrobial peptides (AMPs) are peptides that have activity against a wide range of microorganisms. AMPs can vary greatly in their size, structure, and mode of antimicrobial activity. Due to the immense interest in both testing and characterizing AMPs (from various forms of life) a sustainable method to produce and purify them is necessary. Using Synthetic Biology as a platform, the production of AMPs in E.coli could potentially offer a cost-effective approach for large-scale peptide manufacture, as opposed to isolation from natural sources. After successfully manufacturing several AMPs using E.coli, these peptides will be tested on a wide variety of organisms to screen for antimicrobial activity.",Antimicrobial peptides (AMPs). sustainable.  cost-effective. large-scale. antimicrobial activity.,E. coli
Cornell,2013,using lignin-degrading fungi and plant matter to produce a biodegradable Styrofoam substitute.,"The goal of Organofoam is to develop a fundamental toolkit of genetic parts for engineering complex fungi, particularly plant-pathogenic basidiomycetes. We were inspired to do so by a local company, Ecovative Design, that uses lignin-degrading fungi and plant matter to produce a biodegradable Styrofoam substitute. The existing product that we are seeking to improve, known as “mushroom packaging,” is a sustainable and necessary alternative to Styrofoam. Polystyrene can take hundreds of years to degrade in landfills, produces dozens of identified chemical toxins upon combustion, and is tremendously inefficient to recycle, thus posing difficulties for disposal and polluting the environment. However, the production efficiency of Ecovative’s substitute suffers due to contamination from pathogenic molds, a problem that we seek to solve using synthetic biology. Using the complex, plant-pathogenic basidiomycete, Ganoderma lucidum, as a chassis, we are expanding the accessibility of fungal genetic engineering and demonstrating its utility for commercial purposes.",lignin-degrading. plant-pathogenic. mushroom packaging. fungi. Styrofoam,Ganoderma lucidum
SDU-Denmark,2013," In this project we introduce prenyltransferase into E. coli and simultaneously manipulate the bacteria to produce more of the IPP links, consequently leading to the production of natural rubber in the bacterial setting.","The growing demand for natural rubber causes deforestation of the rainforest or occupation of arable lands, all due to the founding of new plantations. If producing rubber by bacteria succeeds, production of natural rubber will not be limited to the regions where the rubber tree can grow. Our project aims to make an E. coli strain able to produce natural rubber while grown under controlled conditions. Natural rubber is composed of polymerized IPP (isopentenyl pyrophoshate) units. E. coli already possesses the ability to produce IPP, but it lacks the polymerization enzyme, prenyltransferase, from the rubber tree. In this project we introduce prenyltransferase into E. coli and simultaneously manipulate the bacteria to produce more of the IPP links, consequently leading to the production of natural rubber in the bacterial setting.",natural rubber. IPP (isopentenyl pyrophoshate). prenyltransferase. IPP links. E. coli,E. coli
Wageningen_UR,2013,"The aim is to transfer the entire lovastatin metabolic pathway from A. terreus into a GRAS organism like Aspergillus niger. To expand our scope they will also be working on host engineering, trying to create a single cell phenotype of Aspergillus niger.","The fact that secondary metabolites are often synthesized as polymer backbones that are subsequently diversified greatly via the actions of tailoring enzymes sets the stage for combinatorial biochemistry because their biosynthesis is modular. One of the goals is to establish a modular system of domain shuffling to generate a plethora of novel enzymes with new and improved functionalities. The production of lovastatin, a drug used in lowering LDL cholesterol for patients suffering from cardiovascular disease, has been chosen as a proof of principle. The aim is to transfer the entire lovastatin metabolic pathway from A. terreus into a GRAS organism like Aspergillus niger. To expand our scope they will also be working on host engineering, trying to create a single cell phenotype of Aspergillus niger. To increase the accessibility of our host they also deliver a set of tools, which include ATP and pH biosensors, cytoskeletal gfp-fusions and chromoproteins.",secondary metabolites. tailoring enzymes. modular. lovastatin. Aspergillus niger. ,E. coli
 Greensboro-Austin,2013, Using an Expanded Genetic Code product bioadhesive.,"Mussel adhesive proteins (MAPs) are water-resistant bioadhesives that have a variety of biomedical and construction applications. Replicating the natural properties of MAPs through in vivo production using microbes is difficult as it depends on post-translational modifications, primarily the hydroxylation of tyrosine residues to L-DOPA. Since adhesiveness is correlated with L-DOPA content, the project aims to improve the adhesive properties of MAPs by utilizing a strain which inserts the non-canonical amino acid L-DOPA at UAG stop codons during translation. When combined with the in vivo production of free L-DOPA, this system is a significant step towards rapid, cost-effective MAPs production. They also worked on degrading odorous compounds, computationally modeled the detection of potentially dangerous oligo orders, and created BactoArt using inducible fluorescent proteins. Additionally, they created the Open Sequence Initiative, which is focused on updating the standards for submitting BioBricks to the iGEM Registry.",BactoArt.  L-DOPA. MAPs. water-resistant bioadhesives. cost-effective,E. coli
Tsinghua-E,2013,Darwinian evolution for microbial cell factory:in vivo evolution engineering towards tryptophan-overproduction superbug,"Darwinian evolution shows great power in creating incredible biological function in amazing speed. Inspired by this, they aimed at creating novel fast and irrational microbial cell factory by simulating natural Darwinian evolution process. With tryptophan as target product, a novel tryptophan biosensor utilizing translating ribosome mechanism was firstly developed as the foundation for tryptophan productivity and selection pressure switch module. They further constructed this tryptophan overproduction selection gene circuit coupling with in vivo mutation machine (mutator gene of mutD). By fine-tuning the selection conditions,  selection circuit showed good tryptophan dependent growth property, which provides the foundation for further evolution. As a preliminary result of this project, they successfully evolved an ancestor with zero productivity to a high-tryptophan producer only after several rounds of evolution.",Darwinian evolution. cell factory. tryptophan. tryptophan biosensor. mutator gene of mutD,E. coli
Yale,2013,they evaluate the potential of using multiplex automated genome engineering to raise both yields and chain lengths of biosynthesized PLA by directing the E. coli metabolism to funnel resources toward PLA production without sacrificing the organism’s viability. ,"Poly(lactic acid) (PLA) is a biodegradable, biocompatible, bioresorbable, thermoplastic bioplastic that offers many advantages over other biomaterials in both commercial and medical applications. The current chemical method of synthesizing PLA is expensive, and the required processing and purifying steps use many environmentally unfriendly chemicals. Recently, E. coli has been engineered to produce PLA, but low yields and short chain lengths prevent the approach’s commercial use. Here, they evaluate the potential of using multiplex automated genome engineering to raise both yields and chain lengths of biosynthesized PLA by directing the E. coli metabolism to funnel resources toward PLA production without sacrificing the organism’s viability. Efficient biosynthesis of PLA, which may be thus achieved, would be a significant step in reducing the impact of plastic waste, and would benefit those receiving bone implants. It would also open up a new possibility in rapid manufacturing of personalized bone implants using three-dimensional printers.",PLA. bioplastic. multiplex automated genome engineering. Efficient biosynthesis. bone implants,E. coli
Imperial_College,2013,Plasticity: Engineering microbes to make environmentally friendly plastics from non-recyclable waste,"Accumulation of waste represents a considerable problem to humanity. Over the next 50 years, the global community will produce approximately 2 trillion tonnes of waste, or 2.5 times the weight of Mount Everest. Traditionally, mixed non-recyclable waste is sent to landfill or for incineration, both of which result in environmental damage. The detrimental effects are perpetrated by the plastic degradation into toxic byproducts and the production of greenhouse gases by these processes. As an alternative they propose to upcycle this mixed waste into the bioplastic poly-3-hydroxybutyrate (P3HB) to create a closed loop recycling system.Engineered E. coli will operate within sealed bioreactors. In the future they picture the use of our system in a variety of contexts as part of our M.A.P.L.E. (Modular And Plastic Looping E.coli) system.",waste. P3HB.  M.A.P.L.E.  greenhouse gases. E. coli,E. coli
Wageningen_UR,2013,"The aim is to transfer the entire lovastatin metabolic pathway from A. terreus into a GRAS organism like Aspergillus niger. To expand our scope they will also be working on host engineering, trying to create a single cell phenotype of Aspergillus niger.","The fact that secondary metabolites are often synthesized as polymer backbones that are subsequently diversified greatly via the actions of tailoring enzymes sets the stage for combinatorial biochemistry because their biosynthesis is modular. One of the goals is to establish a modular system of domain shuffling to generate a plethora of novel enzymes with new and improved functionalities. The production of lovastatin, a drug used in lowering LDL cholesterol for patients suffering from cardiovascular disease, has been chosen as a proof of principle. The aim is to transfer the entire lovastatin metabolic pathway from A. terreus into a GRAS organism like Aspergillus niger. To expand our scope they will also be working on host engineering, trying to create a single cell phenotype of Aspergillus niger. To increase the accessibility of our host they also deliver a set of tools, which include ATP and pH biosensors, cytoskeletal gfp-fusions and chromoproteins.",secondary metabolites. tailoring enzymes. modular. lovastatin. Aspergillus niger. ,E. coli
 Greensboro-Austin,2013, Using an Expanded Genetic Code product bioadhesive.,"Mussel adhesive proteins (MAPs) are water-resistant bioadhesives that have a variety of biomedical and construction applications. Replicating the natural properties of MAPs through in vivo production using microbes is difficult as it depends on post-translational modifications, primarily the hydroxylation of tyrosine residues to L-DOPA. Since adhesiveness is correlated with L-DOPA content, the project aims to improve the adhesive properties of MAPs by utilizing a strain which inserts the non-canonical amino acid L-DOPA at UAG stop codons during translation. When combined with the in vivo production of free L-DOPA, this system is a significant step towards rapid, cost-effective MAPs production. They also worked on degrading odorous compounds, computationally modeled the detection of potentially dangerous oligo orders, and created BactoArt using inducible fluorescent proteins. Additionally, they created the Open Sequence Initiative, which is focused on updating the standards for submitting BioBricks to the iGEM Registry.",BactoArt.  L-DOPA. MAPs. water-resistant bioadhesives. cost-effective,E. coli
Tsinghua-E,2013,Darwinian evolution for microbial cell factory:in vivo evolution engineering towards tryptophan-overproduction superbug,"Darwinian evolution shows great power in creating incredible biological function in amazing speed. Inspired by this, they aimed at creating novel fast and irrational microbial cell factory by simulating natural Darwinian evolution process. With tryptophan as target product, a novel tryptophan biosensor utilizing translating ribosome mechanism was firstly developed as the foundation for tryptophan productivity and selection pressure switch module. They further constructed this tryptophan overproduction selection gene circuit coupling with in vivo mutation machine (mutator gene of mutD). By fine-tuning the selection conditions,  selection circuit showed good tryptophan dependent growth property, which provides the foundation for further evolution. As a preliminary result of this project, they successfully evolved an ancestor with zero productivity to a high-tryptophan producer only after several rounds of evolution.",Darwinian evolution. cell factory. tryptophan. tryptophan biosensor. mutator gene of mutD,E. coli
Yale,2013,they evaluate the potential of using multiplex automated genome engineering to raise both yields and chain lengths of biosynthesized PLA by directing the E. coli metabolism to funnel resources toward PLA production without sacrificing the organism’s viability. ,"Poly(lactic acid) (PLA) is a biodegradable, biocompatible, bioresorbable, thermoplastic bioplastic that offers many advantages over other biomaterials in both commercial and medical applications. The current chemical method of synthesizing PLA is expensive, and the required processing and purifying steps use many environmentally unfriendly chemicals. Recently, E. coli has been engineered to produce PLA, but low yields and short chain lengths prevent the approach’s commercial use. Here, they evaluate the potential of using multiplex automated genome engineering to raise both yields and chain lengths of biosynthesized PLA by directing the E. coli metabolism to funnel resources toward PLA production without sacrificing the organism’s viability. Efficient biosynthesis of PLA, which may be thus achieved, would be a significant step in reducing the impact of plastic waste, and would benefit those receiving bone implants. It would also open up a new possibility in rapid manufacturing of personalized bone implants using three-dimensional printers.",PLA. bioplastic. multiplex automated genome engineering. Efficient biosynthesis. bone implants,E. coli
Imperial_College,2013,Plasticity: Engineering microbes to make environmentally friendly plastics from non-recyclable waste,"Accumulation of waste represents a considerable problem to humanity. Over the next 50 years, the global community will produce approximately 2 trillion tonnes of waste, or 2.5 times the weight of Mount Everest. Traditionally, mixed non-recyclable waste is sent to landfill or for incineration, both of which result in environmental damage. The detrimental effects are perpetrated by the plastic degradation into toxic byproducts and the production of greenhouse gases by these processes. As an alternative they propose to upcycle this mixed waste into the bioplastic poly-3-hydroxybutyrate (P3HB) to create a closed loop recycling system.Engineered E. coli will operate within sealed bioreactors. In the future they picture the use of our system in a variety of contexts as part of our M.A.P.L.E. (Modular And Plastic Looping E.coli) system.",waste. P3HB.  M.A.P.L.E.  greenhouse gases. E. coli,E. coli
UC_Chile,2013,Whateversisome: create your own bacterial functional organelle,"Compartmentalization is a characteristic of complex biological systems. Carboxysomes are proteinaceous bacterial microcompartments that evolved to optimize bacterial metabolic reactions. They sought to take advantage of this biological principle to design a platform for in vitro metabolic engineering. Whateversisome it’s based on two hypotheses: the targeting signal to the microcompartment is present in a subunit of RuBisCO and that after isolation Carboxysomes can maintain their metabolic capacity in vitro. To address these hypotheses, they designed a system to target proteins of interest to the Carboxysome using RuBisCO subunits as targeting signals. They showed colocalization of GFP fusion proteins and Carboxysome shell-proteins fused to RFP. Second, they designed a simple system for Carboxysome purification based on biotinylation that should enable easy isolation of recombinant Whateversisomes. Their approach would enable combinatorial in vitro metabolic engineering by producing and combining arbitrary Whateversisomes. This project takes advantage of subcellular organizational principles for metabolic engineering.",Compartmentalization. Carboxysomes. RuBisCO. RFP. GFP,E. coli
Minnesota,2013,The pMNBB vector system: A toolkit approach for engineering Pichia pastoris,"Currently, there is a significant gap in available resources for transformation and expression of foreign proteins in the industrially-relevant yeast model, Pichia pastoris. To address this, they have constructed pMNBB, a versatile shuttle vector system. pMNBB vectors provide researchers a modular BioBrick platform to introduce synthetic pathways into E. coli and also the option to rapidly transfer these constructs into P. pastoris. Not only is this vector system designed for integration of expression cassettes into the P. pastoris genome, but they have also added elements which allow for the episomal maintenance of these plasmids. Moreover, these vectors are amenable to trans-kingdom conjugation (TKC). Rather than following a yeast transformation protocol that can take days to weeks, their constructs may be introduced to a yeast culture in roughly one hour. Finally, as a proof-of-concept, they use the pMNBB vector system to produce and secrete active human insulin from P. pastoris.",Pichia pastoris.pMNBB. E. coli. TKC. constructs,E. coli 
USP-Brazil,2013,"Their product is a bioengineered sensor, which will be able to detect levels of methanol above 2% in common alcoholic drinks.","Their product is a bioengineered sensor, which will be able to detect levels of methanol above 2% in common alcoholic drinks. This will allow government to make high-throughput screening of ethanol drinks tainted will methanol. The device will be used as an initial low cost and portable test. The construction is based on the pAOX promoter, which is activated by methanol and repressed by ethanol. Several parts of the device must be tuned for proper function in Pichia pastoris; pAOX promoter, red fluorescent protein (RFP), Mxr1p transcriptional factor and FLD promoter. Since they aim to develop a product ready for the consumer to use, they plan to develop a plastic container for the lyophilized yeast, printed by 3D printer, that will help perform the test and will also contain the yeast. After use, the container will be able to apply bleach to eliminate the yeast.",bioengineered sensor. alcoholic. pAOX promoter. RFP. 3D printer,Pichia pastoris
BIT-China,2013,Intelligent Microbial Heat Regulating Engine,"To keep the cells in a good condition, cooling system is used to control the temperature in fermentation process. However, the cooling system can result in a great consumption of energy, which increases the cost of production and causes resources wasting, global warming indirectly. To settle this problem, they constructed an Intelligent Microbial Heat Regulating Engine (I'MHeRE), which includes the customized thermo-tolerance system and the intelligent quorum regulating system, to help cells resist heat by regulating the expression of heat shock proteins and controlling the density of cells. The chassis host with I'MHeRE may make the fermentation less depend on the cooling system and shrink cost. Besides, cells could live well in higher temperature, because we extend their optimum living temperature and make them live in optimizing density. Owing to this, the activity of the enzymes in cells could be increased and the efficiency of microbial metabolism could be improved.",cooling system. fermentation. heat shock proteins. Intelligent. enzymes,E. coli
EPF_Lausanne,2013,Taxi.Coli: smart drug delivery," The team’s vision is to build a biosynthetic drug delivery concept. The key word of this project is “adaptability”. Our goal is to explore a way of using E.Coli as a highly modular carrier, opening the gate to several applications and alternatives in disease treatments. Using the principles of synthetic biology, we engineered a gelatinase secreting E. Coli able to bind gelatin nanoparticles using a biotin-streptavidin interaction and release them in a corresponding location. The drug delivery system is built in three parts: 1) the nanoparticle binding and 2) the environment sensing that 3) triggers the gelatinase release of the engineered E. Coli, liberating the content of the nanoparticle. The nanoparticles made of gelatin are able to carry any type of organic compound leading to a wide range of applications.",adaptability. drug delivery. gelatinase. E. coli. biotin-streptavidin interaction,E. coli
SJTU-BioX-Shanghai,2013,we aim to combine two systems together in order to provide a universal and convenient tool which can be used to regulate different genomic genes simultaneously and independently in a quantitative way. ,"Few researches have been done to regulate gene expression levels in genomic scale so far. This year we aim to combine two systems together in order to provide a universal and convenient tool which can be used to regulate different genomic genes simultaneously and independently in a quantitative way. 

Our project involves the newly developed gene regulating tool CRISPRi and three light-controlled expression systems induced by red, green, and blue light respectively. Simply by changing the regulating parts in CRISPRi system towards mRFP, luciferase, and three enzymes, we hope to prove our system can be used qualitatively, quantitatively and practically step by step. 

We have also designed a box and written a software as our experiment measurements. Simply by typing in several parameters, different gene expression levels can be controlled. This system can also be improved to predict the maximized producing efficiency after some simple tests in future.",CRISPRi. light-controlled. mRFP. luciferase. enzymes,E. coli
