 Team  ,Year,SimpleDescription,Description,Keywords,Chassis
Dundee,2013,"The ToxiMop project attempts to tackle the problem of freshwater algal blooms by detecting, reducing, and reporting the levels of the algal toxin microcystin. ","The ToxiMop project attempts to tackle the problem of freshwater algal blooms by detecting, reducing, and reporting the levels of the algal toxin microcystin. Microcystin’s toxic action lies in its ability to bind to the human Protein Phosphatase 1 (PP1), which is a major regulator of cell division, protein synthesis and other essential processes. Using synthetic biology techniques, they engineered bacterial chassis (E. coli and B. subtilis) to express PP1, which covalently binds to microcystin. The engineered bacteria can then be used as a molecular mop, the ToxiMop, to remove microcystin from contaminated water. Additionally, they attempted to develop a biological detector for microcystin, which was combined with the electronic device, the Moptopus. This device has the potential for real-time monitoring and analysis of water bodies.","algal blooms
microcystin
toxin
detect
",E. coli 、 B. subtilis
BIOSINT_Mexico,2014,"a modular system, plastic and ready to incorporate to A. thaliana; in order to extract the metals, in particular mercury, from the soil and convert it into a less reactive species. ","The project was developed in three modules, that works as a machinery, being its main functions, acting as a biosensor of heavy metals contamination and as a bio-remediator and bio-acumulator of mercury found in soil and water. The three modules are in charge of specific tasks, the first one, regulates the transportation of mercury from the environment to the interior of the cell, also this module allows the cell to process derived compounds from mercury, specifically, methyl-mercury, and change its chemical form to a less toxic, which is Hg++.; the second is a biosensor that uses degreening system, which acts as a visual reporter for detection of metal contamination in the substrate; finally, the third module is controlled by a light switch incorporated in the cell, responsive to far red light (740 nm light-wave) which allow us to deactivate the de-greening process once the contamination is reported.

","arabidopsis, mercury bioaccumulation, modular Sensor,  red light switch",Arabidopsis
BNU-China,2014,"our project aims to establish an E.coli strain that is able to capture Mo in the medium, directional deliver itself to root system and kill itself eventually.","The plasmids into E.coli Prometheus to make it express a special fusion protein: one side of it, INPN, anchors on the outer membrane, and the other side, ModA, absorbs molybdate. The engineered E.coli Prometheus can thus recruit molybdate. It also  has a suicide clock system for bio-safety concerns. E.coli Prometheus will deliver Mo directly to the root of plants, so the heavy mental pollution of Mo will almost decrease to Zero according to our experiment results. This will also open a new chapter of biological fertilizer. At last, there is  a model to mimic the movement pattern and predict the efficiency of the Prometheus E.coli.","E.coli  model, 3-D root model,  molybdate transport system,  fix nitrogen",E.coli
Braunschweig,2014," equip the model organism E. coli with the methane monooxygenase (sMMO), an enzyme complex enabling methanotrophs to use the greenhouse gas methane as a sole source of carbon and energy","This technique can successfully express all components of the methane monooxygenase in E. coli in soluble form and we, furthermore, proved the activity of the complete enzyme complex. After construction and transformation of final device and optimization of the cultivation conditions, it produce one of the sMMO’s subunits, MMOC, in soluble form and another one, MMOX, in inclusion bodies. To achieve effective production of the remaining subunits in the soluble fraction we further analysed cotransformation of engineered E. coli strain with different combinations of known chaperone proteins.  For reasons of protection against bacteria-consuming ciliates in rumen fluid and thus to enable survival of E. cowli, it also been tested entrapment and cultivation in alginate beads. Using a methane sensor we were also able to show degradation of methane by engineered bacterium E. cowli."," pollution, shortage of energy , global warming, methane",E.coli
BUCT-China,2014,"rapid water quality detection mainly rely on LuxAB ,which encodes a kind of luciferase","Through two kinds of approaches we may achieve rapid water quality detection. One of the approaches is so called comprehensive detection, here it mainly rely on LuxAB ,which encodes a kind of luciferase. Because anything toxic within the water may have a negative impact on the activity of luciferase, the luminescence is likely to be decreased. The other is specific detection, because only in this way can we successfully quantify specific metal ions like Hg(II). One sequence of MerR operon occupies a significant position along with quorum sensing system. In addition, it use gfp as reporter."," water quality, quorum sensing system, comprehensive biosensor, ",E.coli
Carnegie_Mellon,2014, A BioNetGen model of the sensor and NetLogo model of fish populations were constructed to improve our understanding of these systems.,"Due to concern with the compounds in water, we are developing a sensor to detect the molecules in water that will bind to the estrogen receptor. We anticipate that our STREAM, Sensor That Reports Endocrine Activating Molecules, will be sensitive and informative of water quality. A BioNetGen model of the sensor and NetLogo model of fish populations were constructed to improve our understanding of these systems.","steroid hormones,  sensor, water ，T7RNAP",E.coli
Cornell,2014,"create genetically engineered strains of E.coli that could sequester the nickel, mercury, and lead from water sources. Each strain included a metal transport protein specific to the respective metal as well as a metallothionein to bind metal ions intracellularly","This team are engineering bacterial strains that will simultaneously express heavy metal transport proteins and metallothioneins, a class of low-molecular weight, cysteine-rich proteins with high binding affinities for various heavy metals. The heavy metal transport proteins are specific to certain metals and will cause rapid intake of these ions. The metallothioneins will then bind to these ions intracellularly and permanently sequester them. After filtration, the respective heavy metals can be isolated by recollecting the cells from the filter."," nickel, mercury, lead,  water sources, metallothioneins","E. coli DH5α, E. coli BL21"
Evry,2014,The sponge is one of the most powerful filtrating system alive.  The  project is based on the engineering of  Pseudovibrio denitrificans in order to develop a filtrating system allowing to sense and even degrade pollutants in water when cooperating with sponges.," They are driven to design a bioremediation tool based on the considerable filtration capacity of sponges to decrease the marine pollution and protect aquatic ecosystems. This project is based on the engineering of this bacterium in the microbiome in order to develop a filtrating system allowing to sense and even degrade pollutants in water .They focused on the sponge Spongia Officinalis, which lives in episymbiosis with the bacterium: Pseudovibrio denitrificans.In order to be able to transform our bacterium with genes of interest, they  have created a new backbone enabling us to use the transposon system in our bacterium. This tool allows to insert genes easily into unknown bacteria.  "," seas and oceans, sponges, microbiome, Phenol sensor,","Pseudovibrio denitrificans,  Spongia Officinalis"
Exeter,2014, a biological system that will enable safe bioremediation and detection of two of the most common explosives: TNT and Nitroglycerin (NG). ,"They sought to design a system that would degrade TNT or NG; importantly this should be to a non-toxic product; detect TNT or NG in a sample;
terminate all cellular viability when there was no TNT or NG remaining in the sample. In the degradation/transformation aspect of the project, we are focussed the development of two parts containing the bacterial enzymes, NemA and XenB. In order to asses whether any reporter or enzyme part they made had a basis for comparison, they  investigated the Xenobiotic Tolerance of our E.coli strains to gauge toxicity levels to TNT and NG."," TNT ,  Nitroglycerin (NG)",E.coli
Gaston_Day_School,2014,using bacteria to produce biofuels such as isobutanol and ethanol;   increase the sensitivity levels ofthe cadmium detector,"They  have decided to launch a biofuel-focused project. To create the alcohols, we are developing alcohol-resistant strains of E. coli through artificial selection. Also, they  are using PCR to amplify and ligate the genes GlmZ, GlmY, and IlmV, which are used in native alcohol production. The combination of these genes and the alcohol resistant strains are the first steps in their new biofuels project. ","biofuels, Cadmium, alcohol ",E.coli
Hannover,2014,o equip plants with a protein which binds four different heavy metals at the same time and hence brings a significant reduction in the heavy metal concentration of grounds and seas about,"There goal was to engineer a transgenic plant, that is able to bind heavy metals like cadmium, arsenic, zinc and copper. Therefore, metal binding proteins were fused (called Top 4 metal binding protein, T4MBP). To avoid cytotoxic effects on the plant caused by the heavy metals, they decided to place T4MBP to the cell exterior. With a secretion signal (Expa4) the T4MBP is directed to the extracellular space. The protein is tethered to the cell surface by using a cellulose binding domain (CBD). Plant cells have a cell wall which consists of cellulose. Via the cellulose binding domain the protein is attached to the cell wall.",Heavy metals   Plant vector  Arabidopsis thaliana   Nicotiana tabacum,E.coli
HIT-Harbin,2014,construct a device for rapid detection of dioxins inside yeast.,"So as to detect dioxins blisteringly, they have constructed device for rapid detection of dioxins inside yeast. They utlized associability between the gene for testing dioxins of MOUSE as receptor and dioxins as antibodies, together with the regulation conducted by lexA operator to downstream promoters so that mdr and lexA are combined, and, striding a step further, induce downstream gene with the presence of dioxins. Eventually, they can achieve the goal of detecting dioxins rapidly through the system of positive feedback of flourescin. ","dioxins, biological detector,  lexA operator , positive feedback ",Yeast
Hong_Kong_HKU,2014," This teampresent two  products: (1) a methodology for convenient purification of the affinity tagged-Eut BMC, and; (2) a plasmid that allows efficient and rigorous cloning and modification of the BMC-cargo system for expression and various experiments.","Bacterial microcompartments (BMCs) - by its name, refers to large organelles that occur in prokaryotes to provide micro-compartmentalizations for various metabolical process. To structurally construct the compartments, 5 genes from the Eut gene cluster is required. They are: EutS, EutM, EutN, EutL, and EutK, the suffix alphabets being the designation of order of genes found in the Eut gene cluster. ",Bacterial microcompartments，Eut gene，BMC-cargo system,E.coli
HNU_China,2014," design and manufacture an inexpensive, disposable Paper Analytical Device (PAD) for the detection and quantification of organophosphate (OP) and 4-nitrophenol (4NP) based pesticides.","Our team plans to design and manufacture an inexpensive, disposable Paper Analytical Device (PAD) for the detection and quantification of organophosphate (OP) and 4-nitrophenol (4NP) based pesticides. This electrochemical biosensor would be able to detect these toxic substances in waterways around the world, but would most likely have the most impact in developing regions. 
This project meets iGEM synthetic biology requirements by utilizing gene sequences for a fusion protein to be inserted into the standard plasmid backbone. This plasmid can be inserted into E. coli in order to yield the essential fusion protein, organophosphate hydrolase-cellulose binding domain (OPH-CBD) for use in our device.","  organophosphate,   4-nitrophenol, electrochemical biosensor, waterways  ",E.coli
HUST-China,2014,"designing gene circuits to gather copper ions,degrade cyanide, 
detoxify fluoride and suggest whether the water is safe for further use.","They  combined heavy metal meditation with RBC (Rotating Biological Contactor), which is a biofilm-based reactor technology widely used for sewage treatment, and developed a toolkit being able to gather copper ions, degrade the cyanide, detoxify the fluoride in the sewage and suggest whether the water is safe in terms of copper amount at the same time. The bacteria are so capable in defeating bad guys (harmful chemical compounds in the project) and retracting valuable resources in environment (Copper ions)","heavy metal， biofilm-based reactor， copper ions, degrade cyanide, detoxify fluoride",E. coli BL21
IIT_Delhi,2014,genetically engineer E.coli and equip it with the genes to synthesize nitrite reductase enzyme NrfA and CysI (sulfite reductase) and Sqr (Sulfide Quinone reductase) enzymes. NrfA reduces NOx to ammonia (NH3) while Cys1 and Sqr reduce sulphur dioxide (SO2) to hydrogen sulfide (H2S) and H2S to sulfur(S) respectively.," They have engineered nrfA gene (codes for nitrite reductase) in E.Coli to convert NOx to NH3 and for SOx reduction we will incorporate cysI(sulfite reductase) that converts SO2 to H2S (Growth Yields and Growth Rates of. Desulfovibrio vulgaris (Marburg) growing on Hydrogen plus Sulfate and Hydrogen plus Thiosulfate as the Sole Energy Sources, Arch. Microbiol. 117, 209-214 [1978]) and sqr (sulfide quinone reductase) to convert H2S to S.  We anticipate that the use of genetically engineered bacterium would subside the efficiency of existing chemical methods.
","Nox, Sox, greenhouse gases, Nitrite reductase enzyme, sulfide-quinone reductase ",E. coli 
 Minnesota,2014,"A continuous filration device that can deadly methylmercury to inorganic, gaseous mecury. ","This construct was assembled from the mer operon in Serratia marscecens in the plasmid pDU1358, and is designed to contain an upstream regulatory gene merR, two genes encoding for transport proteins merP (periplasmic) and merT (transmembrane), a gene encoding mercuric reductase MerA, and finally a gene encoding organomercurial lyase MerB. The phsABC genes from Salmonella enterica serovar Typhimurium LT2 encode thiosulfate reductase, which catalyzes the stoichiometric production of hydrogen sulfide and sulfite from thiosulfate for heavy metal removal by precipitation.","Mercury Bioremediation, Heavy Metal Bioprecipitation, merT (transmembrane)

","E. coli, Pseudomonas, Shewanella"
 Missouri_Miners,2014,"The goal of this project is to modify the genome of Cyanothece 51142, a cyanobacteria species, to allow it to fix a variety of nitrogen oxide compounds that are major pollutants present in coal flue emissions.  ","The goal of this project is to modify the genome of Cyanothece 51142, a cyanobacteria species, to allow it to fix a variety of nitrogen oxide compounds that are major pollutants present in coal flue emissions. The Missouri S&T iGEM Team plans to clone and standardize genes from Pseudomonas aeruginosa and Escherichia coli that will allow Cyanothece 51142 to uptake and convert nitrogen oxides into ammonium, a major component of fertilizer. This could lead to a method to reduce polluting emissions while producing fertilizer to offset the costs of scrubbing the emissions.","nitric oxide ,  nitrate", cyanobacteria
 Nanjing-China,2014,"This project is to construct a system to perform tasks like amplifying expression and quantitatively detection. The whole system can solve problems such as detection and degradation of toxins, enhanced expression of specific protein, timing of experiments and quantitative measurement of specific molecule.","This project is to construct a system to perform tasks like amplifying expression and quantitatively detection. The system is consisted of several sections such as the QUANTITIVE DETECTOR, the HANDLING SECTION, the SUICIDE SYSTEM and the TIMER.This design is modularized, replaceable, and efficient. The whole system can solve problems such as detection and degradation of toxins, enhanced expression of specific protein, timing of experiments and quantitative measurement of specific molecule.
"," quantitive detevtor, suicide system, timer, degradation of toxins",E. coli
 NCTU_Formosa,2014,This project plan to produce PBANs through E.coli and make the PBAN come in contact with the target insect. The target insect will then start producing pheromones and attract more target insects.,"This team plan to produce PBANs through E.coli and make the PBAN come in contact with the target insect. The target insect will then start producing pheromones and attract more target insects. In our project, they will biologically synthesize PBAN with the E.coli. They store the PBAN inside a trapping device. In the device, there will be appropriate lighting and nutrient sources that will attract insects. Once an insect is attracted into our device and ingests the nutrient sources we provide, it will also inevitably come in contact with our PBAN. As the PBAN works and activates the pheromone synthesis of the attracted insect, more of this species of insect’s counterparts will be attracted and later captured.ach of the PBAN basic parts can use different promoters, RBS and terminators to make many different regulation","Biological Control Method, Pheromones, harmful insects", E.coli
 NEFU_China,2014," The designed bacteria consists of three modules in function. The first function is a detecting system that displays the presence of cadmium ions. The second function is a recycling system that synthesizes the cadmium sulfide nanocrystals to recycle ions. The last function is a flocculating system to increase the flocculent activity of the bacteria containing cadmium sulfide nanocrystals so that we can easily collect the nanocrystals formed by our engineered bacteria, as well as to avoid secondary pollution. ","The designed bacteria in our project consists of three modules in function. The first function is a detecting system that displays the presence of cadmium ions. The second function is a recycling system that synthesizes the cadmium sulfide nanocrystals to recycle ions. The last function is a flocculating system to increase the flocculent activity of the bacteria containing cadmium sulfide nanocrystals so that we can easily collect the nanocrystals formed by our engineered bacteria, as well as to avoid secondary pollution. Eventually, we can realize our double-win goal, safeguarding our environment by removing heavy metal ions and yielding available nanocrystals","Heavy metals, zinc, cadmium, detecting system,  recycling system,  flocculating system", E.coli
 NTNU_Trondheim,2014,"a plasmid, which when placed inside photosynthetic bacteria, increases their rate of CO2 fixation. ","This project is attempting to produce a plasmid, which when placed inside photosynthetic bacteria, increases their rate of CO2 fixation. In order to achieve this, they first construct BioBricks that allow inducible expression of non native genes in our chassis; Synechocystis sp. PCC 6803, when assembled.",CO2 fixation, E.coli
  NJAU_China,2014,". There are copA promoter,marO（operator of mar locus） and cueO promoter existing in E.Coli, all of which are directly or indirectly regulated by copper ions. The most sensitive and effective one (copA)was chosen to trigger the sequential reactions. Glutathione is an intracellular redox-active tripeptide thiol which can effectively detoxify the metal ions by chelation. It can be synthesized by gshF, which can unify both necessary reactions in one platform.","Escherichia coli has high tolerance for copper through specific systems. There are copA promoter,marO（operator of mar locus） and cueO promoter existing in E.Coli, all of which are directly or indirectly regulated by copper ions. The most sensitive and effective one (copA)was chosen to trigger the sequential reactions. Glutathione is an intracellular redox-active tripeptide thiol which can effectively detoxify the metal ions by chelation. It can be synthesized by gshF, an coding sequence derived from Streptococcus thermophilus, which can unify both necessary reactions in one platform.In addition, we also utilize sgRNA-dCas9 system to enhance the efficiency of chelate cupric and cuprous by repressing the expression of copA. With all these design, an automatically and efficiently copper-preventing guard have been created successfully."," copper ions, copA promoter, marO,  sequential reactions, glutathione", E.coli
Oxford,2014,"DCMation, a novel bioremediation approach whose applications are limited only by the versatility of bacterial metabolism. OxiGEM are tackling environmental pollution by developing a user-friendly device for the detection & degradation of the hazardous yet indispensable solvent dichloromethane (DCM), to illustrate."," our project is driven and refined by the dialogue between modelling simulations and experimental data. Bioremediation is optimised by expressing the DCM degrading system in host strains, along with microcompartments to accelerate the reaction and minimise toxic intermediates. Our biosensor is tuned to our characterisation and improvements of the catalytic efficiency of the system, while incorporation of the bacteria into novel diffusion-limiting biopolymeric beads ensures safe and rapid degradation. 
This all-round modular design and scalability make DCMation ideal for extension to the disposal of many harmful substances. ","dichloromethane， Bioremediation, biosensor, rapid degradation, ", E.coli
Peking,2014,"?in order to improve the method of annihilating algal bloom, Peking iGEM engineered?E.coli?to kill the cyanobacteria and degrade the toxins existing in the aquatic ecosystem.","First, they innovatively introduced a bactericidal enzyme, lysozyme to annihilate the algal bloom. Then, except for treating the remarkable biomass of cyanobacteria, the toxins secreted by cyanobacteria contribute to other serious environmental problems. they used holin, a hole-forming membrane protein, and endolysin, a muralytic enzyme, to construct a suicide system which will be triggered when M. aeruginosa are killed and the concentration of specific inducer molecules decreases.","algal bloom, cyanobacteria, degrade the toxin，suicide system", E.coli
SZU-China,2014,"Basing on the alkaline cellulase in suffering at present technology application and considering its beautiful and broad application prospects , they design a super Escherichia coli alkaline cellulase machine","They have made a super bacteria-Super Dream Factory of Cellulase.The factory has four parts. They are alkaline cellulase, Mdfa antiporter, kil   protein and ccdB suicide system. 
To enhance the effects of decontamination in various fields, they  use an alkaline cellulase as detergent additive. The alkaline cellulase gene was introduced into the Escherichia coli and the target enzyme can be highly produced with the help of Kil, which is one of the core elements of our project. What’s more, MdfA, a proton pump across the cell membrane, was added to transport the proton into the cytoplasma, and release Na+/K+ at the same time, resulting in cell survival in alkaline industry wastewaters as high as pH 9.5. They  also added a ccdB suicide system to the e-machine, by this you could remove the biological machine whenever you need for biological safety.

","alkaline cellulase,  ccdB suicide system, antiporter, kil   protein", E.coli
SYSU-Software,2014,"With mathematically simulation and visualization, this software automatically joins parts and modules and consequently a system come into being.","With standardized biobricks and databases, the software automatically joins parts and modules and consequently a system come into being. After define the inputs, outputs and logic between them, this software offers you with different solutions , the performance of each can be visible via a rader map. This software can mathematically simulate three major characteristics that describe the behaviour of the system: static performance, dynamic performance and expression efficiency.","Logic, Metacircuit design",
AMU-Poznan,2014,"With off-target validation and immune motifs presence verification, this automative software is for sh-miR design and in silico validation.",This software is for sh-miR design and in silico validation. In sh-miR designer v2.0 only the mRNA number (from NCBI database) can be provided to predict molecules targeting desired transcript. This automative software expanded functionality of the software with off-target validation and immune motifs presence verification and also extended the miRNA-shuttles database. ,"sh-miR design, Off-target",
HFUT_CHINA,2014,"Based on the users’ habits, this software is to recommend biobricks.","This software is to recommend biobricks for participators when they are designing new devices. By collecting the information of existing devices and making analysis on these devices, Biodesigner will recommend biobricks based on the users’ habits or the biobricks users have been used.",Recommend biobricks,
