 Team  ,Year,SimpleDescription,Description,Keywords,Chassis
BIOSINT_Mexico,2015,A biosensor that expresses chromoprotein reporters to create a colorful bacterial photography,"This project aims to bioengineer E. coli to serve as a biosensor that expresses chromoprotein reporters. Two light receptors were used, one for red light-sensing, cph8, and one for the blue light-sensing, YF1. 
When the bacteria are irradiated with an specific wavelength of 660nm, 470 nm, amilGFP and chromoprotein spisPink’s expression is repressed. When the system is in total darkness both proteins are expressed and a third colour is formed.
This project aims to bioengineer E. coli to serve as a biosensor that expresses chromoprotein reporters. Two light receptors were used, one for red light-sensing, cph8, and one for the blue light-sensing, YF1. 
When the bacteria are irradiated with an specific wavelength of 660nm, 470 nm, amilGFP and chromoprotein spisPink’s expression is repressed. When the system is in total darkness both proteins are expressed and a third colour is formed.
",photography; color; biosensor,E.Coli K12
NYU_Shanghai,2015,This project translates the color and positions of bacteria colonies on a plate into sound composition.,"There are three main components to the bacterial music generator: (1) bacteria colonies (2) tube rack (3) button control. We engineered bacteria to express different colors and lights through chromoproteins, fluorescent proteins, luciferase, and oscillating amounts of luciferase. We then translated bacterial colonies on a plate into a step sequencer, which creates patterned expressions of sound. The tube rack and button control add extra layers of interaction and control.",music; machine,E.Coli
SVA-NYC,2015,Applying color as a metric for soil nutritional analysis by Mobile App,We engineered E. coli K-12 to express various chromoproteins in the presence of molecules that pertain to soil and plant nutrition. E. coli K-12 are placed on the microfluidic cartridge which will be loaded into a portable device and integrated with phone and it’s case. The “color data” can be captured and measured by the phone’s camera. This data will be instantly uploaded to provide accurate feedback regarding what crops are ideal for the current soil conditions and what measures need to be taken to adjust soil for desired crops.,Nutrition; Measurement; app; phone; Soil,E.Coli K12
Genspace,2015,The project developed three biosensors for sewage and mining metabolic and detoxification pathways for pullutions through extremophile.,"We attempted to construct three different biosensors for sewage based on quorum sensing or nitrogen sensing coupled to production of a colorful reporter to provide the community with a visual indicator of water quality.
We mine the canal bottom extremophile DNA for metabolic and detoxification pathways to metabolize toxic compounds and may be useful for remediation. We completed experiments by using degenerate PCR primers that recognize antibiotic synthesis pathways.
We attempted to construct three different biosensors for sewage based on quorum sensing or nitrogen sensing coupled to production of a colorful reporter to provide the community with a visual indicator of water quality.
We mine the canal bottom extremophile DNA for metabolic and detoxification pathways to metabolize toxic compounds and may be useful for remediation. We completed experiments by using degenerate PCR primers that recognize antibiotic synthesis pathways.
",biosensor; pollution; water; extremophile,Pseudomonas aeruginosa; Escherichia coli
London_Biohackspace,2015,"develop an all-in-one toolbox for creating designer brewing yeast strains that can be modified to produce beers with novel flavours, scents, colours, nutrients and bioluminescence.","The project aims to develop an all-in-one toolbox for creating designer brewing yeast strains that can be modified to produce beers with novel flavours, scents, colours, nutrients and bioluminescence. Additional parts are created that allow designers to regulate the level of expression of inserted proteins thus giving users the ability to create novel brewing strains. The project explores how effective such organisms are in producing genuinely novel drink products that can challenge what beer can be, and produces an example product for the future of home brewing: a variety pack / kit for home brewers to experiment with different varieties of engineered yeast in their home brewing endeavours.",brewery; beer; yeast,yeast
SF_Bay_Area_DIYBio,2015,"Generating shinorine, a UV absorbing compound by E. coli to make it UV resistant.","E.coli can easily be killed by UV light. By equipping it with the genes to produce UV absorbing compounds, we expect that the E. coli will become UV resistant as well. We will employ “directed evolution” to make the process better. We think that if we stress the bacteria with UV that they will start to evolve better and more efficient mechanisms to protect themselves from UV.",UV; directed evolution; MAAs,E. coli
Wellesley_TheTech,2015,An interactive exhibit that makes use of key human computer interaction concepts to introduce users to core synthetic biology concepts.,"This digital component of the exhibit uses powerful multitouch surfaces that serve as makerspaces for users to digitally engineer and test bacteria that are helpful for extreme environments such as Mars, Antarctica, and the Deep Sea. The wet-lab component complements to the experience by providing visitors with the opportunity to create colorful representations of the bacteria they created virtually. This project aims to design, prototype, and evaluate a new interactive museum exhibit that engages visitors in a bio-design activity while facilitating learning of bio design concepts and skills. The goal is to create a novel bio-tinkering platform designed for non-scientists to foster skills for invention and innovation.",Education; Platform; Hardware,
Aalto-Helsinki,2015,This project design an Eschericia coli capable of producing propane from cellulose in usage of fuel.,This project design an Eschericia coli capable of producing propane from cellulose in usage of fuel.,Propane; Cellulose; Green energy,Escherichia coli BL21 (DE3)
Amsterdam,2015,we aimed to engineer a synthetic consortium between photoauxotrophic cyanobacteria and chemoheterotrophs (like E. coli) to turn CO2 into useful carbon product. ,"The basic premise of our consortium’s functionality is simple: a phototroph (Synechocystis PCC 6803 in the case of our prototype consortium) fixates CO2 and converts it to relatively simple carbon compounds. These compounds serve as fuel for a chemoheterotroph (E. coli in the same prototype case), which uses the compounds to produce a desired end-product. Since the CO2-fixating, carbon-sharing Synechocystis is essentially modular, it can be coupled to a multitude of biotechnological production processes to make these processes sustainable, including the dozens of iGEM projects that use E. coli for bioproduction!",Carbon dioxide; Carbon production,Synechocystis PCC6803; E. coli
CHINA_CD_UESTC,2015,Building a enzymatic biofuel cell to exploited energy from bacteria.,"With two high-efficiency oxidases, glucose oxidase and laccase, which could be used in anode region and cathode region respectively. The project constructed to make E.coli produce magnetosomes carrying laccase to enrich it on the cathode.",Enzymatic biofuel cell (EBFC); Magnetotactic bacteria (MTB),E.coli
Groningen,2015,Engineering a Bacillus subtilis biofilm to function as a cation exchange membrane to generate energy.,"We engineer a Bacillus subtilis biofilm to function as a cation exchange membrane. Such a membrane can be used in Reverse Electrodialysis (RED), a technique to generate energy where salt and fresh water mix, for example where rivers flow into the sea. To make the Bacillus subtilis suitable for RED, we first make it more robust by overexpressing the biofilm genes tasA and bslA while preventing reversion to the motile state by knocking out the abrB regulator and overexpressing slrR, another biofilm regulator. Simultaneously, the amino acid polymer gamma-polyglutamic acid was modelled extensively and was proved it could be used to make the biofilm ion selective.",biofilm; STRUCTURAL FIBRES; HYDROPHOBIC COATING; salt,Bacillus subtilis
LaVerne-Leos,2015,Using Zeaxanthin and Tocopherol to protect cyanobacteria from the toxic effects of free fatty acids,"Free fatty acids are biofuel precursors. We focused on using zeaxanthin to counter the toxic effects of increased free fatty acids in an altered Synechococcus elongatus 7942 strain. Zeaxanthin acts as an antioxidant, stabilizes the membrane, and is needed for electron transport chain function. To increase the concentration of zeaxanthin and its precursors, we introduced a circuit containing parts of the zeaxanthin synthesis pathway. The La Ca?ada subset of our team focused on tocopherol, a metabolite that has similar properties to zeaxanthin in cyanobacteria. Tocopherol acts as an antioxidant, protects the cell from lipid peroxidation, and enhances photosynthesis. A circuit was made with the gene p-hydroxyphenylpyruvate dioxygenase to catalyze the formation of homogenistic acid, the rate limiting step of tocopherol synthesis. In an attempt to further increase the production of fatty acids, both zeaxanthin and tocopherol circuits are dynamically regulated, utilizing a fatty acid-sensitive promoter-repressor system, pLR and FadR.",Fatty acid; Zeaxanthin; Tocopherols ,E. coli; Cyanobacteria
Macquarie_Australia,2015,Engineering the chlorophyll biosynthesis pathway and photosystem II in E. coli,"Photosynthesis is a key biological pathway utilized by plants and algae to generate useable energy from sunlight. Chlorophyll is a green pigment in photosynthetic organisms that aids in the manufacture of energy. Our aim is to engineer and express 13 genes of the chlorophyll-a biosynthetic pathway from Chlamydomonas reinhardtii in E. coli. While this pathway has been well characterised, reproduction of this process in non-photosynthetic organisms has not been successful. Our second goal is to synthetically engineer Photosystem II in E. coli, which consists of 17 genes. Photosystem II is a multi-subunit protein complex that generates oxygen and electrons, by oxidation of water molecules. Transferring these electrons to a hydrogenase would potentially lead to production of hydrogen on an industrial scale. Our goals are the first step towards clean and sustainable hydrogen production as a viable future energy source.",,E. coli
NTU-Singapore,2015,Usage of Shewanella bacteria in microbial fuel cells,"The world is facing an impending energy crisis due to our over-reliance on fossil fuels, which are rapidly being depleted. Hence, there is an urgent need to explore alternative energy sources that are renewable and affordable. A microbial fuel cell (MFC) is an attractive solution to the global energy crisis. It is a device that utilizes microorganisms to convert chemical energy stored in various organic or inorganic compounds to electrical current. In our project, we seek to explore the usage of Shewanella bacteria in MFCs. We are performing flux balance analysis on the metabolic network of Shewanella and are genetically perturbing different nodes in the network to determine if the power output of the MFC can be enhanced. Additionally, we are developing and characterizing new genetic parts to aid us in our engineering of the Shewanella bacteria.",microbial fuel cell (MFC),Shewanella bacteria
Purdue,2015,Development of Synthetic Yeast for Enzymatic Pretreatment of Lignocellulosic Biomass,"The production of some biofuels is inhibited by lignin, a complex organic polymer which physically blocks carbohydrate substrates and inhibits biomass degrading enzymes (BDEs). A common biofuel practice is to sequester lignin using energy-intensive thermal pretreatment. The recent development of a synthetic yeast that spatially separates lignin degradation products from vulnerable BDEs enables an efficient lignin breakdown system to reduce the energy input for biofuel production. By expressing enzymes from lignin-degrading species (termites and white rot fungi), we aim to establish a novel enzymatic pretreatment system in a yeast chassis. Six enzymes were selected for their ability to operate at room temperature and standard pH. The expressed enzymes were evaluated individually and in combination for lignin-degradation efficiency. Furthermore, we designed an additional vector to contain our genetically modified yeast using an oxygen-repressed killswitch.",lignin; biomass degrading enzymes (BDEs),Yeast J4
Reading,2015, Creating Biological photovoltaics to exploit energy from Cyanobacteria ,"Conventional photovoltaics provide a clean source of renewable energy but have the disadvantages of being expensive and containing toxic materials. This years iGEM project was to develop a cheaper, non-toxic, alternative to conventional fuel cells; using synthetic biology. Biological photovoltaics (BPV) are a promising candidate to provide an alternative. Our BPV uses the Cyanobacterium Synechocystis sp. PCC 6803 as the electron source. Using a purpose built fuel cell and Synechocystis, which has been genetically modified to improve interactions between the bacterium and the anode surface, enables the BPV to generate a greater voltage. This BPV will be considered for large scale usage in homes and communities worldwide as a cheap, simple and clean alternative to conventional energy sources.",Renewable energy;  Biological photovoltaics (BPV) ; Cyanobacteria ,Cyanobacterium Synechocystis sp. PCC 6803
TJU,2015,construction of synthetic microbial consortia MFC (microbial fuel cell) system with three species.,"MFCs are capable of converting the chemical energy stored in the chemical compounds in organic biomass to electrical energy with the aid of microorganisms. However, traditional single-strain MFC faces many practical barriers such as low current density, high cost and unstable electricity output, which seriously impede the future applications.
To solve these problems, extending engineering capabilities from single-cell behaviors to multi-cellular microbial consortia brings us new inspiration. So we establish a co-cultured MFC system with an elaborate labor division.
Based on our complicated co-cultured system, a rational designed relationship of material, information and energy is being explored. We regulate lactate metabolism, the key point of material flux, through lactate sensing system, orthogonal targeted protease degradation, etc. Additionally, we also make riboflavin as the entry point to regulate energy and information relationship. Through reconstruction of the co-cultured MFC, a more efficient and robust system is built up.
MFCs are capable of converting the chemical energy stored in the chemical compounds in organic biomass to electrical energy with the aid of microorganisms. However, traditional single-strain MFC faces many practical barriers such as low current density, high cost and unstable electricity output, which seriously impede the future applications.
To solve these problems, extending engineering capabilities from single-cell behaviors to multi-cellular microbial consortia brings us new inspiration. So we establish a co-cultured MFC system with an elaborate labor division.
Based on our complicated co-cultured system, a rational designed relationship of material, information and energy is being explored. We regulate lactate metabolism, the key point of material flux, through lactate sensing system, orthogonal targeted protease degradation, etc. Additionally, we also make riboflavin as the entry point to regulate energy and information relationship. Through reconstruction of the co-cultured MFC, a more efficient and robust system is built up.
",MFC (microbial fuel cell); co-culture,Zymophyte 1&2 ; Electriclgen;
UCSC,2015,designing microorganisms to convert plant waste into viable replacements for fossil fuels.,"The project focuses on designing microorganisms that will be able to convert plant waste into viable replacements for fossil fuels. To achieve this goal our team has four main focuses for the experiment each dealing with specific portions of the project. Our Breakdown team is dedicated to producing cellulases within our desired microorganisms to convert the cellulose in plant waste to sugars. The Fermentation team is working on altering the fermentation pathways within our microorganism to convert sugars into alcohol products by transformation of genes found in other alcohol producing microbes. Our Field team is responsible for identifying novel cellulose digesting microorganisms from high saline test sites.
", extreme salt environments; carbon; fossil fuel, Haloferax volcanii 
UNITN-Trento,2015,optimize MFC’s platform using an engineered E. coli that exploits sunlight to live better under stressful conditions and that has an increased electron production.,"Microbial Fuel Cell (MFC) technology is rapidly evolving due to interest in producing sustainable electricity. Typically, MFCs exploit complex mixtures of microorganisms in which the identity of the microorganisms are unknown. The undefined nature of the source of electrons leads to limitations in the control and optimization of the MFC. We, therefore, attempted to improve the MFC platform by exclusively using E. coli engineered to survive under stressful conditions. E. coli cells were modified to express a light-driven proton pump, which required the assembly of a cofactor synthesis pathway. The proton gradient generated upon the exposure of light was then used by the bacteria to synthesize ATP, thereby turning E. coli into a type of pseudo-autotroph. Furthermore we investigated different genetic approaches to improve the secretion of electrons from E. coli. We built an MFC prototype with our engineered bacteria that are driven by light, which we called “Solar pMFC.”",Microbial Fuel Cells (MFCs); SUNLIGHT POWER,E. coli
Westminster,2015,Energy production in Escherichia coli using exoelectrogenic genes (Mtr-pathway) found in Shewanella oneidensis MR-1 ,"Shewanella oneidensis MR-1 has the ability to adapt to both aerobic and anaerobic environments, as well as utilise a number of toxic compounds such as manganese and uranium. We have been working on introducing the Mtr pathway into Escherichia coli, in order to increase the electrical output in a microbial fuel cell (MFC). ",Microbial Fuel Cell; Mtr pathway,E. coli
Bielefeld-Germany,2013,The Bielefeld-Germany iGEM Team developed Microbial Fuel Cell (MFC) to generate electricity with a modified Escherichia coli in a self-constructed fuel cell.,"To generate electric energy with a genetically modified Escherichia coli in a self-constructed fuel cell， The Bielefeld-Germany iGEM Team investigated different genetic approaches. Using synthetic biology, they designed different BioBricks for bioelectricity generation. Specific electron transfer proteins have been compiled from a variety of organisms, in order to gain an Escherichia coli Fuel Cell platform, which turns E. coli to an electro active organism. The main challenge was to provide for an efficient electron transfer from the bacteria to the electrode. Therefore they facilitated and improved electron donation by producing electron-shuttles, so called endogenous mediators, as well as permeabilizing the cell surface by integrating large membrane porins and providing a direct electron pathway by conductive transmembrane protein structures. All these electron transport elements increased electron transfer and bioelectricity generation.","electric energy
bioelectricity
electron transfer
",E. coli 
BIT,2013,"A New Strategy to Detect Antibiotics in Milk: Based on Sensors with Controllable Bio-enhanced Blocks.In a synthetic biological way, 2013 BIT iGEM assembled the T7 RNA polymerase gene and T7 promoter as an amplification block (amplifier).","
To solve the problem of antibiotic, the sensor has been divided into two, respectively, of tetracycline and β-lactam. There is a response, for each sensor. They are all assembled in a downstream of the amplification block (amplifier) and the control block (controller). The output signal will be amplified, by adjusting the concentration of IPTG to achieve the adjustment of magnification. Amplifier by the T7 RNA polymerase gene and T7 promoter composition control block is through the downstream of the T7 promoter plus lacO and the addition of regular expression lacI, by adjusting the concentration of IPTG, lacO then adjust the boot situation achieved, the final response module for the green fluorescent protein.
","Antibiotic
Biosensor
Amplifier
",E. coli 
British_Columbia,2013,"The bacterial immune system CRISPR (Clustered Regularly Interspaced Short Palindromic Repeats) is one way in which bacteria naturally deal with phage infection in the environment and has become a powerful tool in genetic engineering, with specificity at the single nucleotide level. ","The British_Columbia iGEM Team analyzed all available sequence information from two common phage families that infect E. coli and designed the most broadly neutralizing systems possible. This work provides a proof-of-concept experiment for engineering bioreactor immunity, and provides all the sufficient modules to facilitate future engineering of CRISPR in bacteria. ","Phage
Infection
bacterial immune system
bioreactor
",E. coli
Calgary,2013,"To solve the problem of foodborne illnesses from pathogenic E. coli, iGEM Calgary is developing the FerriTALE to detect harmful E. coli, which uses engineered proteins that detect and report the presence of dangerous E. coli in a sample.","iGEM Calgary used synthetic biology to develop a system to rapidly detect the presence of EHEC in the beef industry. They designed the sensor for testing in the beef industry provides as well as in things like vegetables, water, and other livestock. By using engineered biological nanoparticles and DNA binding proteins, pathogenic DNA sequences can be detected specifically. The biosensor functions at the genomic level to detect the presence of EHEC in a sample. This system allows us to quickly identify contamination during meat processing and also provides the ability to pre-screen cattle to limit potential sources of contamination before cattle enter the processing plant.","E. coli
foodborne illnesses
detector
",
Alberta,2013,"""The Littlest Mapmaker"" is the University of Alberta's effort to create a biological computer capable of solving the Travelling Salesman Problem, a logistical challenge in which a hypothetical salesman must find the shortest route through a series of destinations.","The travelling salesman computer is built from a combination of raw DNA chemistry and bacterial colonies: first it assembles the routes by stringing genes together, treating them like roads on the salesman's map, then the bacteria sort the good routes from the bad, identifying the answer through the quantity of bacterial colonies making use of each route. The most commonly used route is the winner.","Travelling Salesman Problem
biological computer
",E. coli
ETH_Zurich,2013,"Colisweeper is an interactive, biological version of the Minesweeper computer game, based on luxI/luxR quorum sensing and chromogenic enzymatic reactions whose goal is to clear an agar “minefield” without detonating mines.","Genetically engineered Escherichia coli colonies are used as sender-cells (mines) and receiver-cells (non-mines). Mines secrete the signaling molecule N-(3-oxohexanoyl)-l-homoserine lactone (OHHL) whereas non-mines process the signal. To distinguish between OHHL-levels, a library of PLuxR promoters with various sensitivities was created through site-saturation mutagenesis. High-pass filters were constructed to control the expression of different orthogonal hydrolases in non-mines, depending on the number of surrounding mines. Additionally, the mines express their own hydrolase. A spatiotemporal reaction-diffusion model was established to evaluate and improve the system. To play Colisweeper, a colorless substrate solution is pipetted onto a colony of choice. The result is a defined color change within minutes, allowing identification of the played colony and the number of mines surrounding it.",Minesweeper game,Escherichia coli 
KU_Leuven,2013,"The KU Leuven iGEM 2013 team teach E.coli cells to hack into insects signaling systems to drive off the aphids and attract the natural predators, such as the ladybug.","The bacteria that modified by The KU Leuven iGEM 2013 team called BanAphids and it produced two pheromones. The first one is methyl salicylate, which plays a role in a plant’s defence response and is produced by the plant upon aphid infestation. The second pheromone is E-β-farnesene, which is an aphid alarm pheromone. In this system the BanAphids produce E-β-farnesene to repel aphids, while the methyl salicylate is meant to attract their natural predators such as ladybugs.","Aphids
Pheromones
plant’s defence
",E. coli
