 Team  ,Year,SimpleDescription,Description,Keywords,Chassis
Waterloo,2014,This team proposes to combat MRSA infection by delivering gene-silencing systems: CRISPRi and RNAi through a Staphylococcus conjugative plasmid. ,"Methicillin resistant Staphylococcus aureus (or MRSA) is an infection-causing pathogen that are well known for their resistance to all β-lactams due to the expression of the mecA gene from the mec cassette. This team proposes to combat this infection by delivering gene-silencing systems: CRISPRi and RNAi through a Staphylococcus conjugative plasmid. This will effectively disable the antibiotic resistant phenotype over time so that a β-lactam antibiotic can then be administered to kill the MRSA. As a proof of concept, their gene silencing mechanisms will target a YFP gene within a Staphylococcus population. They also improve the efficiency of an existing conjugation plasmid so as to develop a more effective means of delivery between Staphylococcal organisms.","MRSA, CRISPRi",Staphylococcus
 WPI-Worcester,2014,"This team develops an E.coli based cell surface antigen expression system that can be utilized as a diagnostic tool for nearly any viral, bacterial, or fungal infection.","One of the biggest causes of antibiotic resistance lies in the farming industry; more than 3 times the amount of antibiotics given to humans are administered to livestock. Over-prescription of antibiotics promotes resistance in both livestock pathogens and natural flora, which can be transmitted to humans through meat and other products. A cheap, quick, and reliable mechanism for detecting and identifying infection is one solution to this problem. This team develops an E.coli based cell surface antigen expression system that can be utilized as a diagnostic tool for nearly any viral, bacterial, or fungal infection. The recombinant E.coli are utilized in a direct agglutination test using the host organism’s serum. This team successfully demonstrated the feasibility of this diagnostic tool using a GFP antibody and antigen pair.","Antibiotic resistance, Cell surface antigen expression",E.coli
Tsinghua,2013,"A sensing yeast powder based portable test paper; a frame of testing any pathogen that will cause diseases; a ""fast-shifting box"" to accomplish the combination of input and output signaling.","The team aims to design a sensing yeast powder based portable test paper, that is, the "" mobile"" testing system, take advantage of querom sensing system in bacteria, to achieve the testing of specific microorganism caused disease. In the same time, they built a frame of testing any pathogen that will cause diseases, using different the input and output combination. Furthermore, in order to achieve the simultaneous testing of different pathogens, the team designs a “fast-shifting box” to accomplish the combination of input and output signaling.","testing of pathogenic diseases, querom sensing system, input and output combination, simultaneous testing",yeast
TU-Delft,2013,"An E. coli that can detect S. aureus, using S. aureus’ native quorum sensing system, in order to locally produce and deliver AMPs.","The project consists of an E. coli that can detect S. aureus, using S. aureus’ native quorum sensing system, in order to locally produce and deliver AMPs. Upon detection, peptides inactivated by a SUMO-tag fusion, are overexpressed. After a delay period, introduced through a negative transcriptional cascade, a SUMO protease is expressed cleaving off the inactivating tag. Using this mechanism, high concentrations of peptide are delivered at the infection to efficiently kill S. aureus. As a safety mechanism, the timer also activates an E. coli kill-switch.","S. aureus, quorum sensing system, AMPs, SUMO",E. coli
 UIUC_Illinois,2013,A engineered probiotic to prevent TMAO-related cardiovascular health conditions by outcompeting the gut bacteria for L-carnitine in order to suppress the production of TMAO.,"The team created a probiotic to attack the problem of TMAO by outcompeting the gut bacteria for L-carnitine in order to suppress the production of TMAO. L-carnitine transporters (caiX and cbcWV) and L-carnitine dehydrogenase (CDH) derived from Pseudomonas aeruginosa were expressed in a safe strain of E. coli (Nissle 1917). This engineered E. coli can uptake and metabolize L-carnitine along an alternative, safe pathway into 3-dehydrocarnitine. Together, this system offers a novel solution in preventing TMAO-related cardiovascular health conditions.","CVD, TMAO, L-carnitine, caiX, cbcWV, CDH", E. coli
 Aix-Marseille,2014,"Synchronizing a culture of E. coli cells, so that they divide synchronously and change color from green to red and back as they go through the cell cycle.","The project focuses on synchronizing a culture of E.coli cells, so that they divide synchronously and change color from green to red and back as they go through the cell cycle. To control the cell cycle, this project relies on a re-engineered chemotaxis system which instead of controlling the flagellar rotation direction drives changes in gene expression in response of the cell community through the use of a series of on/off switches and a modified serine production pathway. These different components will create an oscillator that regularly drives the switch modules between their two states.","re-engineered chemotaxis system, on/off switches, modified serine production pathway, divide synchronously",E. coli
Cooper_Union,2014,"Micro-Toolbox, an open source solution utilizes a novel enzymatic approach towards controllable de novo DNA synthesis; performed rapidly, inexpensively and less toxic than current methods.","In Micro-Toolbox, the team propose the ultimate kill switch mechanism, a yeast-based chassis that features a programmable lifespan based on telomeres. Simplified DNA assembly will lead to a greater emphasis on pathway design and characterization in bioengineering programs. For schools, the ""Biohacker Kit"" utilizes a modular input/output binary plasmid platform that allows students to rapidly generate and test multiple biosensor configurations, with no “cutting and pasting” required. Inexpensive access to quality laboratory gear will be made possible by the “Open Hardware” collection of devices.","open source solution, controllable, de novo, DNA synthesis, kill switch, modular input/output binary",yeast
ETH_Zurich,2014,"Mosaicoli aims at investigating emergence of complex patterns from a simple rule by engineering a cellular automaton into E. coli, which may provide novel building blocks for biological computers.","The project Mosaicoli aims at investigating emergence of complex patterns from a simple rule by engineering a cellular automaton into E. coli. This automaton comprises a grid of colonies on a 3D-printed millifuidic chip. Each colony is either in an ON or OFF state and updates its state by integrating signals from its neighbors according to a genetically pre-programmed logic rule. Complex patterns are visualized by fluorescence after several steps of row-wise propagation. Besides, Mosaicoli overcomes the leakiness and crosstalk present issues in biological systems by exploiting multichannel orthogonal communication, riboregulators and integrase-based XOR logic gates.",biologic gates in engineering bacterium,E. coli
 Tokyo_Tech,2014,"E. coli was made to accumulate and excrete phosphate just like a bank. Besides, a E. coil system imitating central bank can work as a signal molecule stabilizer.","The team designed Escherichia coli which can act like a bank. In order to mimic the bank system, E. coli was made to accumulate and excrete phosphate just like what bank does with money. This ""Bank E. coli"" enables someone to deposit and withdraw phosphate at any time. Additionally, the team designed a system consisted of three kinds of E. coli: imitating bank, company and customer. In this system, they exchange signal molecules as currency. By using the cell-cell communication, the team are trying to make ""Bank E. coli"" work as a signal molecule stabilizer like a central bank.","Bank E. coil, cell-cell comunication, signal molecules, control, regulation", E. coli
UCSF_UCB,2014,To understand complex intercellular interactions underlying specific community phenotypes by engineering communication motifs; developing a circuit capable of analyzing cellular community interactions.,"The project seeks to understand complex intercellular interactions underlying specific community phenotypes by engineering communication motifs with the goal of reaching a community behavior to either converge or diverge in response. To do this, novel sense-and-secrete circuits have engineered into yeast. To model community signaling, the team repurposed endogenous yeast mating factor alpha(MFα) as an extracellular signal. The designed circuit outputs initial individual responses to stimuli as GFP signal and a downstream community-coordinated response is reported as RFP signal. Based on all above, a circuit capable of analyzing cellular community interactions is hoped to develop.","intercellular interactions, specific community phenotypes, engineering communication motifs, sense-and-secrete circuits, MFα",yeast
 Evry,2013,"Escherichia coli is engineered using the Ferric Uptake Regulation (FUR) couple to an inverter system, in order to produce these siderophores in presence of iron.","The project focuses on diseases that are subsequent to an iron overload such as hemochromatosis and thalassemia. The team engineer Escherichia coli using the Ferric Uptake Regulation (FUR) couple to an inverter system, in order to produce these siderophores in presence of iron. To reduce the patient's iron absorption, their bacteria is encapsulated in a pill. Once it arrives in the duodenum, the bacteria will produce the siderophore at their full potential and chelate the iron.","iron overload, FUR, inverter system, siderophore",E. coli
 Goettingen,2013,"To build a screening system targeting c-di-AMP, which could be applied in novel-drug screening. It can visualise and measure the level of c-di-AMP in the cell.","Bacteria acquire resistance against antibiotics and become unbridled. So it's important to control the use of antibiotics as well as to develop new antibiotics, which can suffiently eliminate the invaders without hurting the ""good"" bacteria. The project is to build a screening system targeting c-di-AMP, which could be applied in novel-drug screening. With this system, the level of c-di-AMP in the cell can be visualised and measured.","resistance against antibiotics, c-di-AMP, novel-drug screening, visuable", E. coli
Groningen,2013,A possible solution for complications resulting from implanted medical devices: form a protective biocompatible layer between the implant and the body by means of a spider silk coating.,"Approximately half of all implanted medical devices result in one or more medical complication. A possible solution for these complications is to form a protective biocompatible layer between the implant and the body by means of a spider silk coating. This is achieved through mathematical modelling, techniques from the synthetic biology, and the Gram-positive bacteria Bacillus subtilis, which is redesigned to secrete silk and to self-assemble into a biofilm surrounding the implant. It uses a modified chemotaxis system coupled to the DesK heat sensing system to do so.","implanted medical devices, medical complication, protective biocompatible layer, mathematical modeling, spider silk, self-assemble", Bacillus subtilis
Hong_Kong_HKUST,2013,Creating an artificial futile cycle in mammalian cell by introducing glyoxylate enzymes native to bacteria.,"While low-fat diet and regular exercise are popular approaches to fight with obesity, one easy alternative is simply to increase energy metabolism. The team is working to create an artificial futile cycle in mammalian cell by introducing glyoxylate enzymes native to bacteria. They plan to introduce an inducible system that allows to couple the sensing of circulating fatty acid concentrations with an inducible circuit of glyoxylate shunt. Such a system should increase the feasibility of a glyoxylate cycle engineered to function in vivo.","energy metabolism, futile cycle, glyoxylate enzyme, inducible system",mammalian cell
IIT_Madras,2013,To neutralize the already produced toxin through a Gb3 mimic peptide. To prevent further toxin production by inhibiting the biofilm formation of shigatoxigenic E.coli using I3A.,"The team propose a two-fold, novel synthetic biology approach to combat the lethal effect of the Shiga toxin, aiming to neutralize the already produced toxin through a nine amino acid Gb3 mimic peptide. They have engineered the Gb3 mimic along with a cellular export signal (ompF) downstream of AHL(quorum sensing molecule) inducible promoter (pLuxR). Besides, they plan to prevent further toxin production by inhibiting the biofilm formation of shigatoxigenic E.coli using indole-3-acetaldehyde (I3A). Validated through functional assays and in silico modelling, the finding provides a new perspective of tackling Shiga toxicosis using synthetic biology tools.","Shiga toxin, Gb3 mimic, ompF, AHL, pLuxR, I3A, modeling",E. coil
Marburg,2013,The sunlight-driven microalgae Phaeodactylum tricornutum has been established as an elegant tool for the production of proteins.,"Nowadays, a major challenge is the development of systems that produce pure, posttranslational modified proteins - best at low costs. Recently, the sunlight-driven microalgae Phaeodactylum tricornutum has been established as an elegant tool for the production of proteins. A major - however yet unchallenged - advantage of this system is the production of advanced proteins with specific posttranslational modifications and the ability of their direct secretion into the medium allowing easy purification with low effort and costs. The team's mission is to challenge Phaectory for the convenient production of antibodies and make the system accessible to following iGEM teams.","pure, posttranslational, modified, sunlight-driven, low costs, antibody, system",Phaeodactylum tricornutum
 NJU_China,2013,"Trying to express both anti-virus siRNA within the cell and target protein on the surface of the MVs by engineering the HEK 293T cell, which produces large amounts of MVs.","To combine the advantages of small interfering RNA(siRNA) and Microvesicles(MVs), the team are trying to express both anti-virus siRNA within the cell and target protein on the surface of the MVs by engineering the HEK 293T cell, which is capable of producing large amounts of MVs. Thus, the MVs produced by our engineered HEK 293T cells will contain the siRNA and be able to specifically deliver the siRNA to the sites we want, acting as biomissile for the targeted destruction of the disease.","siRNA, MVs, HEK 293T cell, site-specific delivery, transport, drug carrier",HEK 293T cell
Duke,2014,Two possible approaches to demonstrating ultra-sensitivity in CRISPR: cooperative repression and molecular titration.,"Nowadays, the function or robustness of many circuits created by means of CRISPR/Cas9 relies on ultrasensitive, switch-like responses from the transcription factors involved. Currently, CRISPR-based tools have distinctively analog, non-Boolean responses, making them unsuitable for use in functions that require a steep response curve. Tools that introduce Boolean-like ultra-sensitivity into the CRISPR system would increase its versatility for applications in complex gene circuits. The team is implementing two possible approaches to demonstrating ultra-sensitivity in CRISPR: cooperative repression and molecular titration.","CRISPR/Cas9, robustness, ultrasensitive, boolean, cooperative repression, molecular titration",E. coli
Edinburgh,2014,"A newly invented inter-cellular communication method to iGEM, called Metabolic Wiring, using intermediates from metabolic pathways as signalling molecules, superior to the conventionally used quorum sensing.","The team is introducing a newly invented inter-cellular communication method called Metabolic Wiring. This method uses intermediates from metabolic pathways as signalling molecules, and is superior to the conventionally used quorum sensing due to improved orthogonality, wider range of signalling molecules available, and extensibility. The team will develop three metabolic wires using aromatic degradation, sugar degradation, and cis-genic wires. To demonstrate its potential, the three wires will then be implemented in a population control system and used to regulate the growth of a single bacterial strain in a mixed population, depending on the population sizes of the remaining strains.","inter-cellular communication, metabolic pathway, signalling molecule, population control",E. coli
 Kyoto,2014,"Confirming the DMS biosynthesis pathway by introducing 5 candidate genes in Fragilariopsis cylindrus; a diatom, into Escherichia coli. Forming the Magnetosome in E. coli by introducing 4 operons.","Two projects of the team-- (1)DMS (dimethylsulfide) synthesis. DMS is known to be a precursor of the cloud condensation nucleus, which greatly affects the climate. The team tried to confirm them by introducing 5 candidate genes in Fragilariopsis cylindrus; a diatom, into Escherichia coli. (2)Magnetosome formation. Magnetosome is a specific organelle in magnetotactic bacteria. The team tried to form the Magnetosome in E. coli by introducing 4 operons which has been lined up recently as the sufficient genes to make magnetosome in Magnetospirillum gryphiswaldense.","DMS, climate, Magnetosome, magnetotactic bacteria",E. coli
 Paris_Bettencourt,2013,"Testing new treatment methods for the global war against Mycobacterium tuberculosis (MTb); 4 synergistic projects aim to help in the prevention, diagnosis, and treatment of tuberculosis.","The team is testing new weapons for the global war against Mycobacterium tuberculosis (MTb), a pathogen that infects nearly 2 billion people. 4 synergistic projects aim to help in the prevention, diagnosis, and treatment of tuberculosis. 1) Reproducing an essential MTb metabolic pathway in E. coli, where it can be easily and safely targeted in a drug screen. 2) Building a phage-based biosensor to allow the rapid diagnosis specifically drug-resistant MTb strains. 3) Constructing a mycobacteriophage to detect and counterselect drug-resistant Mtb in the environment. 4) Programming E. coli to follow MTb into human macrophages and saturate it with bacteriolytic enzymes.","MTb, metabolic pathway, phage-based biosensor, programming",E. coli
 SYSU-China,2013,Designing a new device which can spontaneously select hepatocytes from iPS differentiated cell mass and prevent potential carcinogenesis.,"To solve the problems of IPS's further application, the team designs a new device which can spontaneously select hepatocytes from iPS differentiated cell mass and prevent potential carcinogenesis. To achieve accurate spatiotemporal control, they build a miRNA-122 sensor and make use of the tetracycline induction system. The work may also be extended to the field of gene therapy, and provide a new direction to our train of thought about how to solve the safety problem in genetic manipulation of human cells.","iPSC, ESC, hiPSC, miRNA-122 sensor, specificity of directional differentiation, safety of the transplant, tetracycline induction system",hepatocytes
SCU_China,2015,Engineering two types of E. coli for Terraforming," As a matter of fact, the immigration to Mars, the most earth like planet in solar system, still should be considered as priority. It is noticeable that CO2 and N2 occupy almost 98% of Martian atmosphere. Thus, The team engineered two types of E.coli, which carry out anaerobic carbon fixation with Acetyl-CoA Synthetase/Carbon Monoxide Dehydrogenase(ACS/CODH) system, and nitrogen fixation with Paenibacillthe teamnitrogenase respectively. Based on this purpose, they are called E. Pangu collectively, which is named after the creator of universe, Pan Gu in Chinese mythology. E. pangu is designated to play the role of pioneer organism on Mars immigration. In addition, The team used CRISPR-Cas 9 technique to confirm the reliability of the carbon fixation system and verified a promoter part which can be induced by Rhl and repressed by Las.",Terraforming; Mars; Nitrogen fixation; Carbon fixation; CRISPR-Cas9,E. coli
SCUT,2015,Engineering E.coli to adsorb cadmium ion during the sewage treatment process,"Cadmium ion pollution has seriously affected people's health, agriculture and graziery from all aspects. This year the team attemps to design a novel and effective device in order to remediate global cadmium ion pollution. To solve this problem, The team combine the curli nanofibers CsgA protein on the surface of E.coli with synthetic phytochelatins (ECs), which are analogs of phytochelatins (PCs). ECs are able to chelate with cadmium ion. the engineered bacteria can also identify different concentrations of cadmium ion turning blue for low concentration and red for high concentration.",Biosensor; Pullution; Cadmium ion; ,E. coli
Tokyo-NoKoGen,2015,A new system to exterminate termites using engineered E. coli and pseudo egg,"""ExTermite coli” is a novel system to exterminate termites, which combines an engineered Escherichia coli and a unique pseudo-egg delivery system. The E. coli was engineered to overexpress glucose-3-dehydrogenase (G3DH), which converts trehalose into the trehalase inhibitor 3,3’-diketo-trehalose (3,3’dkt). Because trehalose is a major termite blood sugar and trehalase is essential for trehalose metabolism, G3DH essentially converts trehalose into an insecticide. The pseudo-egg delivery system takes advantage of a habit termites have of carrying their eggs to their nests and licking them. Termites recognize their eggs by sensing β-glucosidase and lysozyme, which act as egg-recognition pheromones. The pseudo eggs, containing both termite egg-recognition molecules and engineered E. coli, will be delivered to their nests and then licked by the termites present, ththe teamallowing the G3DH produced by the E. coli to convert trehalose into insecticide inside the termite bodies. Consequently ExTermite coli can effectively exterminate termites in their nest.",Pests control; Trehalse; Termits; Insecticide; G3DH,E. coli
Toulouse,2015,Modifying E. coli as ApiColi to express butyrate as an attracting molecule to lure Varroa destructor a pests to the bees in the trap,"The parasitic mite Varroa destructor, through the detrimental effects it exerts, is one of the main causes explaining the dramatic decline of bee colonies worldwide. the project aims at limiting its proliferation in hives, ththe teamThe team designed a trap adaptable to the hive entrance. In this device, the Escherichia coli strain named ApiColi will be used as bait. During the day ApiColi will express butyrate as an attracting molecule to lure Varroa destructor in the trap. By night butyrate expression will be replaced by formate production, a deadly molecule for the mite. This circadian rhythm is based on a chimeric red light receptor, which enables the trap to be in line with the honeybee’s life cycle and optimizes the lifespan of the device. ",Butyrate; Honeybee; Varroa destructor; Pests control; Apiculture,E. coli (ApiColi)
UAI-Chile,2015,Wiki Page Empty,Wiki Page Empty,Wiki Page Empty,Wiki Page Empty
UC_Davis,2015,"Development of a Low Cost, User-friendly Biosensor for Triclosan and a Model for Civic Engagement","The team are developing a biosensor for triclosan, an antimicrobial agent whose use has environmental and human health implications. Triclosan inhibits enoyl acp reductase (Fabi). By measuring the rate at which triclosan inhibits Fabi, The team can make a standard curve of percent inhibition vs triclosan, and use this standard curve to determine how much triclosan is present in a wastewater sample. The team can then engineer the enzyme to have greater specificity on the non-native substrate through computational design and kunkel mutagenesis. By coupling the biosensor with civic engagement measures, the goal is to raise awareness and accountability around environmental concerns and to empower citizens to participate in decisions being made about chemical use.",Biosensor; Triclosan; Computational design; Kukel mutagenesis,E. coli
UChile-OpenBio,2015,Designing two populations of Escherichia coli to produce a biodegradable plastic Polylactic acid from easy to assimilate renewable resources.,"The team UChile-OpenBio is designing two populations of Escherichia coli to produce a biodegradable plastic called PLA (Polylactic acid) from easy to assimilate renewable resources. The first population will convert glucose into lactate and will self-regulate its production by sensing the pH. The second population will polymerize lactate into PLA and will export it into the medium. In addition the team is planning to replace the glucose by Chilean brown macroalgae (kelp), a renewable resource to sustainably produce PLA.",Renewable resource; Plastic degradation; Polylactic acid; Biodegradable,E. coli
